{
  "schema": "mcp-dm/gms-compat/abi-evidence",
  "schema_version": 1,
  "build": {
    "profile_id": "gms-3.53.4137.0-windows-x64",
    "host": "DigitalMicrograph.exe",
    "version": "3.53.4137.0",
    "architecture": "x64",
    "identity_source": "experiments/native-bridge/mvp/adapters/gms_3_53_4137/profile.hpp",
    "version_policy": "exact version plus per-module SHA-256; no approximate version range is admitted",
    "modules": [
      {
        "name": "DigitalMicrograph.exe",
        "sha256": "2f03ccd751b2abc7f55d3bda5b975895c3527660a03080618005a134d6fbfddb",
        "check_version": true
      },
      {
        "name": "GMSImage.dll",
        "sha256": "0d8e22006a1023eb9f0de2b497ef1629c5a22c562741d3e4b0405d308590da3b",
        "check_version": true
      },
      {
        "name": "GMSImageProcessing.dll",
        "sha256": "6be3044d049b6b2184404ea5adc2588d0677ae9b2f78ceb80169d315aef82042",
        "check_version": true
      },
      {
        "name": "GMS.dll",
        "sha256": "9056884e38c090b7fff1cefe70150dc49d10dbc1f823fed6c7a661d255c01f93",
        "check_version": true
      },
      {
        "name": "mfc140.dll",
        "sha256": "b784303d86232a1b316c79839aa78bf631b4fc182e55d9d947688adb066dff26",
        "check_version": false
      }
    ]
  },
  "known_operations": [
    "native_crop",
    "native_datasets",
    "native_display",
    "native_fft",
    "native_fft_large",
    "native_filters",
    "native_frame",
    "native_gui_rois",
    "native_histogram",
    "native_histogram_axis",
    "native_histogram_display",
    "native_ifft_large",
    "native_imag_large",
    "native_image_arithmetic",
    "native_line_plot_style",
    "native_line_profile",
    "native_mean",
    "native_numeric_import",
    "native_numeric_import_display",
    "native_phase_large",
    "native_pixel_crop",
    "native_pixel_fft",
    "native_pixel_filters",
    "native_power_large",
    "native_preview",
    "native_profile_display",
    "native_read",
    "native_real_large",
    "native_result_release",
    "native_save",
    "native_statistics",
    "native_uint32_crop",
    "native_uint32_display",
    "native_uint32_fft",
    "native_uint32_fft_large",
    "native_uint32_filters",
    "native_uint32_ifft_large",
    "native_uint32_imag_large",
    "native_uint32_image_arithmetic",
    "native_uint32_mean",
    "native_uint32_phase_large",
    "native_uint32_power_large",
    "native_uint32_preview",
    "native_uint32_read",
    "native_uint32_real_large",
    "native_uint32_statistics"
  ],
  "entries": [
    {
      "id": "image.lookup",
      "title": "Numeric image lookup by ID and by index",
      "area": "image-identity",
      "build_profile": "gms-3.53.4137.0-windows-x64",
      "modules": [
        {"module": "GMSImage.dll", "sha256": "0d8e22006a1023eb9f0de2b497ef1629c5a22c562741d3e4b0405d308590da3b"}
      ],
      "symbols": [
        {"module": "GMSImage.dll", "kind": "export", "name": "?FindByID@Image@GMS@@SA?AV?$ref_ptr@VImage@GMS@@@Gatan@@K@Z", "ordinal": null},
        {"module": "GMSImage.dll", "kind": "export", "name": "?FindByIndex@Image@GMS@@SA?AV?$ref_ptr@VImage@GMS@@@Gatan@@K@Z", "ordinal": null}
      ],
      "call_shape": {
        "abi": "win64_msvc_static_sret",
        "hidden_sret": true,
        "returns": "pointer to the caller-supplied result slot",
        "params": [
          {"name": "out", "type": "NativeImageRef*", "notes": "8-byte caller slot; receives one owned reference or an empty reference"},
          {"name": "id", "type": "uint32_t", "notes": "numeric ID returned by GetID; FindByIndex takes a zero-based registry index instead"}
        ],
        "notes": "A missing ID or out-of-range index yields an empty reference. The adapter checks the returned object's GetID before use."
      },
      "layout": {
        "structures": [
          {"name": "NativeImageRef", "size": "8", "alignment": "8", "fields": "single void* image"}
        ],
        "ownership": "a non-null result owns exactly one strong reference and must be released through image.reference_release; a borrowed pointer must never be released",
        "evidence_source": "experiments/native-bridge/ABI_NOTES.md",
        "evidence_anchor": "## Image identity and ownership"
      },
      "static_evidence": [
        {"source": "experiments/native-bridge/ABI_NOTES.md", "anchor": "## Image identity and ownership", "claim": "static methods returning ref_ptr<Image> receive the hidden result pointer first and write one pointer"},
        {"source": "experiments/native-bridge/mvp/adapters/gms_3_53_4137/profile.hpp", "anchor": "?FindByID@Image@GMS@@SA?AV?$ref_ptr@VImage@GMS@@@Gatan@@K@Z", "claim": "the shipping profile requires this exact decorated export"}
      ],
      "verification": {
        "offline_tests": [
          {"path": "experiments/native-bridge/mvp/adapter_tests.cpp", "note": "selection and identity gates"},
          {"path": "experiments/native-bridge/mvp/core_tests.cpp", "note": "protocol and lifecycle"}
        ],
        "real_host": [
          {"status": "PASS_LIMITED", "record": "experiments/native-bridge/RESULTS.md", "anchor": "## Earlier accepted MVP baseline", "note": "synthetic real-host lookup with matching numeric ID"}
        ]
      },
      "uncertainties": [
        "Atomicity of the registry between calls is not established; a matching count does not prove a stable snapshot.",
        "FindByIndex outside the checked range can raise a host error and is never attempted."
      ],
      "conflicts": [],
      "scope": {
        "operations": ["native_datasets", "native_mean", "native_statistics", "native_crop", "native_display", "native_read", "native_preview", "native_fft", "native_filters", "native_image_arithmetic", "native_frame", "native_histogram", "native_line_profile", "native_gui_rois", "native_numeric_import"],
        "dtypes": ["any registered image (lookup only)"],
        "versions": ["3.53.4137.0"],
        "limits": ["idle host required", "no concurrent edit protection"]
      },
      "qualification": "QUALIFIED_LIMITED",
      "derivation": "static_inspection",
      "revalidation": ["sha256", "export_name", "call_shape", "layout", "ownership"]
    },
    {
      "id": "image.enumerate",
      "title": "Bounded native registry enumeration",
      "area": "image-identity",
      "build_profile": "gms-3.53.4137.0-windows-x64",
      "modules": [
        {"module": "GMSImage.dll", "sha256": "0d8e22006a1023eb9f0de2b497ef1629c5a22c562741d3e4b0405d308590da3b"}
      ],
      "symbols": [
        {"module": "GMSImage.dll", "kind": "export", "name": "?CountAllImages@Image@GMS@@SAKXZ", "ordinal": null}
      ],
      "call_shape": {
        "abi": "win64_msvc",
        "hidden_sret": false,
        "returns": "uint32_t",
        "params": [],
        "notes": "Enumeration prefers count plus zero-based FindByIndex over the functional EnumImages callback, whose allocator-specific vector ABI is not closed."
      },
      "layout": null,
      "layout_absent_reason": "no object crosses this call; only a scalar count is returned",
      "static_evidence": [
        {"source": "experiments/native-bridge/ABI_NOTES.md", "anchor": "## Bounded enumeration", "claim": "count plus index lookup is the preferred bounded enumeration path"},
        {"source": "experiments/native-bridge/ABI_NOTES.md", "anchor": "## Bounded enumeration", "claim": "the registry may include images without visible document windows"}
      ],
      "verification": {
        "offline_tests": [
          {"path": "experiments/native-bridge/mvp/adapter_tests.cpp", "note": "duplicate-ID and count checks"}
        ],
        "real_host": [
          {"status": "PASS_LIMITED", "record": "experiments/native-bridge/RESULTS.md", "anchor": "## Earlier accepted MVP baseline", "note": "DATASETS enumeration against a synthetic host"}
        ]
      },
      "uncertainties": [
        "Registry contents may change between the count and the individual lookups."
      ],
      "conflicts": [],
      "scope": {
        "operations": ["native_datasets"],
        "dtypes": ["metadata only"],
        "versions": ["3.53.4137.0"],
        "limits": ["output budget enforced before any lookup"]
      },
      "qualification": "QUALIFIED_LIMITED",
      "derivation": "static_inspection",
      "revalidation": ["sha256", "export_name", "call_shape"]
    },
    {
      "id": "image.id",
      "title": "Numeric image identity",
      "area": "image-identity",
      "build_profile": "gms-3.53.4137.0-windows-x64",
      "modules": [
        {"module": "GMSImage.dll", "sha256": "0d8e22006a1023eb9f0de2b497ef1629c5a22c562741d3e4b0405d308590da3b"}
      ],
      "symbols": [
        {"module": "GMSImage.dll", "kind": "export", "name": "?GetID@Image@GMS@@QEBAKXZ", "ordinal": null}
      ],
      "call_shape": {
        "abi": "win64_msvc_member",
        "hidden_sret": false,
        "returns": "uint32_t",
        "params": [
          {"name": "this", "type": "const void*", "notes": "borrowed image pointer"}
        ]
      },
      "layout": null,
      "layout_absent_reason": "the call reads no object field through a declared layout; only this-pointer identity is used",
      "static_evidence": [
        {"source": "experiments/native-bridge/ABI_NOTES.md", "anchor": "## Descriptors, calibration, and statistics", "claim": "GetDataType and the descriptor getters read the native descriptor without touching pixels"}
      ],
      "verification": {
        "offline_tests": [
          {"path": "experiments/native-bridge/mvp/adapter_tests.cpp", "note": "identity agreement checks"}
        ],
        "real_host": [
          {"status": "PASS_LIMITED", "record": "experiments/native-bridge/RESULTS.md", "anchor": "## Earlier accepted MVP baseline", "note": "returned ID matched the synthetic source"}
        ]
      },
      "uncertainties": [],
      "conflicts": [],
      "scope": {